{
  "actorId": "ProjectBridge/KJW-80ea388278fd",
  "blockers": [
    "private_operation_requires_review"
  ],
  "nextActions": [
    "비공개 실제 결과 확인"
  ],
  "projectId": "Control-Tower",
  "receivedAt": "2026-10-06T16:46:25.906Z",
  "recordId": "pc-bridge-continuity-20261007-inspect-01",
  "recordType": "task_exchange",
  "request": {
    "details": "사용자가 요청한 공용 PC 작업. 세부 내용은 비공개 경로에 보관.",
    "source": "private_pc_bridge_queue",
    "summary": "명령 실행"
  },
  "response": {
    "details": "실제 결과는 비공개 PC 작업 경로에서 확인합니다. 파일·명령·로그·화면은 공개하지 않습니다.",
    "source": "project_bridge_operational_result",
    "summary": "명령 실행 확인 필요"
  },
  "revision": 1,
  "schemaVersion": 1,
  "sessionId": "KJW-80ea388278fd",
  "status": "blocked",
  "supersedes": [],
  "title": "PC 작업 · 명령 실행",
  "updatedAt": "2026-10-06T16:53:05.160555+00:00",
  "verification": [
    {
      "evidence": [
        "private_pc_bridge_result:KJW-80ea388278fd/continuity-20261007-inspect-01"
      ],
      "name": "실제 작업 결과",
      "result": "fail"
    }
  ],
  "workDone": []
}