{
  "schemaVersion": 1,
  "recordType": "task_exchange",
  "recordId": "task20261006-shared-pc-communication",
  "revision": 1,
  "title": "공용 PC 연결과 소통 화면 통합",
  "projectId": "Control-Tower",
  "actorId": "/root",
  "sessionId": "20261006-shared-pc-communication",
  "receivedAt": "2026-10-06T23:10:25+09:00",
  "updatedAt": "2026-10-06T14:53:33.644Z",
  "request": {
    "summary": "모든 도구가 함께 쓰는 PC 연결을 관리 앱에 통합하고 소통 화면을 사람에게 읽기 쉽게 개선",
    "details": "ProjectBridge 2.0의 github_http_404 원인을 확인하고 실제 PC 장치를 대조한다. 공용 연결의 설치·시작·복구와 독립 작업 병렬 처리를 관리 앱에 넣고 GitHub 중계와 로컬 작업을 구분한다. 소통에 작성자·안 읽음·글/댓글 수·내부 글 이동, 공지 확인 명단의 검색·필터, 상태 색과 아이콘, 부드러운 진행 표시를 제공하고 새로고침 조작을 제거한다. 바탕화면과 기존 오디오북 위치·실행 중 제작 작업을 보존하며 상세 명령·로그·화면·인증값은 공개하지 않는다.",
    "source": "current_chat"
  },
  "response": {
    "summary": "기존 PC 연결 정상 확인, 새 통합 버전 실제 적용 진행 중",
    "details": "현재 실제 PC의 연결은 정상이고, 기존 프로젝트 폴더에도 변경 충돌이 없습니다. 설치 도중 프로그램을 닫아도 설치 자료가 먼저 삭제되지 않도록 보완하고 있습니다. 새 버전은 별도 작업 폴더에서 검사한 뒤 적용하겠습니다. 최종 답변 대기.",
    "source": "current_chat"
  },
  "status": "in_progress",
  "workDone": [
    "기존 2.0의 저장소 메타데이터 API 경로 끝에 추가되던 슬래시 오류를 확인·수정하고 같은 인증으로 접근 성공을 확인했다.",
    "설치 설정과 실제 비공개 장치 기록의 KJW-80ea388278fd를 대조하고 파일·짧은 명령·창 목록 왕복을 확인했다.",
    "공용 로컬 API·MCP·병렬 스케줄러와 자원 충돌·선행 작업 처리 소스를 작성하고 관리 앱 설치·연결·작업 화면에 통합했다.",
    "소통의 작성자·시간·내용별 사용자 읽음·내부 게시글·수정 이력·이전/다음 이동과 공지 명단 집계·검색·필터를 구현했다.",
    "공용 연결·소통 사용 안내와 도구·설치 현황을 현재 검증 범위에 맞춰 갱신했다."
  ],
  "verification": [
    {
      "name": "기존 실제 PC 연결 복구",
      "result": "pass",
      "evidence": [
        "설치 설정·비공개 장치 기록 KJW-80ea388278fd 대조 및 파일·명령·창 목록 실제 응답 확인. 상세 요청·결과는 비공개 통로에 보관"
      ]
    },
    {
      "name": "ProjectBridge 3.0 개발 검사",
      "result": "pass",
      "evidence": [
        "04_COMMUNICATION/remote-bridge/releases/20261006-v3/VALIDATION.json — 65개 검사 통과 시점"
      ]
    },
    {
      "name": "관리 앱 개발 검사",
      "result": "pass",
      "evidence": [
        "관리 담당 실제 개발 검사 보고: .NET 168개 통과 시점. 새 코드 검사와 사용자 PC 설치·화면 검증은 구분"
      ]
    },
    {
      "name": "새 통합 버전 사용자 PC 설치·로그인·전체 왕복",
      "result": "not_run",
      "evidence": []
    }
  ],
  "nextActions": [
    "공용 연결 3.0과 관리 앱 0.8.0을 기존 설정·백업·제작 작업을 보존하며 실제 PC에 적용",
    "기능 조회·파일 읽기·임시 파일 조건부 수정·짧은 명령·화면 캡처·테스트 앱 입력 순으로 새 연결 왕복 확인",
    "로그인 자동 시작·명시적 끄기·비정상 종료 복구와 소통 UI의 실제 화면·상태·안 읽음·명단 동작 확인",
    "검증 결과와 실제 배포 상태를 공개 가능한 요약으로 기록 갱신"
  ],
  "blockers": [],
  "supersedes": []
}
